{
  "cube": "Kaldheim Cube",
  "slug": "kaldheim-cube",
  "tier": "Low",
  "summary": {
    "n_events": 1,
    "n_matches": 10,
    "n_players": 7,
    "first_played": "2025-09-18",
    "last_played": "2025-09-18"
  },
  "trophy_leaders": [
    {
      "player": "Örvar",
      "trophies": 1
    }
  ],
  "player_rankings": [
    {
      "player": "Örvar",
      "match_w": 3,
      "match_l": 0,
      "match_pct": 100,
      "game_w": 6,
      "game_l": 1,
      "game_pct": 86
    },
    {
      "player": "Tommi",
      "match_w": 1,
      "match_l": 1,
      "match_pct": 50,
      "game_w": 3,
      "game_l": 2,
      "game_pct": 60
    },
    {
      "player": "Victor",
      "match_w": 2,
      "match_l": 1,
      "match_pct": 67,
      "game_w": 5,
      "game_l": 4,
      "game_pct": 56
    },
    {
      "player": "Anna",
      "match_w": 2,
      "match_l": 1,
      "match_pct": 67,
      "game_w": 4,
      "game_l": 4,
      "game_pct": 50
    },
    {
      "player": "Oddur",
      "match_w": 1,
      "match_l": 1,
      "match_pct": 50,
      "game_w": 3,
      "game_l": 3,
      "game_pct": 50
    },
    {
      "player": "Diddi",
      "match_w": 0,
      "match_l": 4,
      "match_pct": 0,
      "game_w": 3,
      "game_l": 8,
      "game_pct": 27
    }
  ],
  "events": [
    {
      "date": "2025-09-18",
      "results": [
        {
          "player": "Örvar",
          "match_w": 3,
          "match_l": 0,
          "game_w": 6,
          "game_l": 1,
          "trophy": true
        },
        {
          "player": "Victor",
          "match_w": 2,
          "match_l": 1,
          "game_w": 5,
          "game_l": 4,
          "trophy": false
        },
        {
          "player": "Anna",
          "match_w": 2,
          "match_l": 1,
          "game_w": 4,
          "game_l": 4,
          "trophy": false
        },
        {
          "player": "Tommi",
          "match_w": 1,
          "match_l": 1,
          "game_w": 3,
          "game_l": 2,
          "trophy": false
        },
        {
          "player": "Oddur",
          "match_w": 1,
          "match_l": 1,
          "game_w": 3,
          "game_l": 3,
          "trophy": false
        },
        {
          "player": "Diddi",
          "match_w": 0,
          "match_l": 4,
          "game_w": 3,
          "game_l": 8,
          "trophy": false
        }
      ]
    }
  ]
}
