{
  "cube": "Pauper Cube Victor",
  "slug": "pauper-cube-victor",
  "tier": "Low",
  "summary": {
    "n_events": 2,
    "n_matches": 21,
    "n_players": 11,
    "first_played": "2026-01-22",
    "last_played": "2026-05-14"
  },
  "trophy_leaders": [
    {
      "player": "Aron Elvar",
      "trophies": 1
    }
  ],
  "player_rankings": [
    {
      "player": "Aron Elvar",
      "match_w": 3,
      "match_l": 0,
      "match_pct": 100,
      "game_w": 6,
      "game_l": 1,
      "game_pct": 86
    },
    {
      "player": "Oddur",
      "match_w": 2,
      "match_l": 1,
      "match_pct": 67,
      "game_w": 5,
      "game_l": 2,
      "game_pct": 71
    },
    {
      "player": "Atli",
      "match_w": 3,
      "match_l": 3,
      "match_pct": 50,
      "game_w": 9,
      "game_l": 7,
      "game_pct": 56
    },
    {
      "player": "Tommi",
      "match_w": 3,
      "match_l": 3,
      "match_pct": 50,
      "game_w": 9,
      "game_l": 9,
      "game_pct": 50
    },
    {
      "player": "Binni",
      "match_w": 2,
      "match_l": 1,
      "match_pct": 67,
      "game_w": 4,
      "game_l": 4,
      "game_pct": 50
    },
    {
      "player": "Aron Freyr",
      "match_w": 2,
      "match_l": 1,
      "match_pct": 67,
      "game_w": 4,
      "game_l": 4,
      "game_pct": 50
    },
    {
      "player": "Örvar",
      "match_w": 2,
      "match_l": 1,
      "match_pct": 67,
      "game_w": 3,
      "game_l": 3,
      "game_pct": 50
    },
    {
      "player": "Victor",
      "match_w": 2,
      "match_l": 4,
      "match_pct": 33,
      "game_w": 6,
      "game_l": 9,
      "game_pct": 40
    },
    {
      "player": "Aron Gauti",
      "match_w": 1,
      "match_l": 2,
      "match_pct": 33,
      "game_w": 3,
      "game_l": 5,
      "game_pct": 38
    },
    {
      "player": "Móses",
      "match_w": 1,
      "match_l": 2,
      "match_pct": 33,
      "game_w": 3,
      "game_l": 5,
      "game_pct": 38
    }
  ],
  "events": [
    {
      "date": "2026-05-14",
      "results": [
        {
          "player": "Tommi",
          "match_w": 2,
          "match_l": 1,
          "game_w": 5,
          "game_l": 4,
          "trophy": false
        },
        {
          "player": "Oddur",
          "match_w": 2,
          "match_l": 1,
          "game_w": 5,
          "game_l": 2,
          "trophy": false
        },
        {
          "player": "Atli",
          "match_w": 2,
          "match_l": 1,
          "game_w": 5,
          "game_l": 3,
          "trophy": false
        },
        {
          "player": "Aron Freyr",
          "match_w": 2,
          "match_l": 1,
          "game_w": 4,
          "game_l": 4,
          "trophy": false
        },
        {
          "player": "Móses",
          "match_w": 1,
          "match_l": 2,
          "game_w": 3,
          "game_l": 5,
          "trophy": false
        },
        {
          "player": "Victor",
          "match_w": 0,
          "match_l": 3,
          "game_w": 2,
          "game_l": 6,
          "trophy": false
        }
      ]
    },
    {
      "date": "2026-01-22",
      "results": [
        {
          "player": "Aron Elvar",
          "match_w": 3,
          "match_l": 0,
          "game_w": 6,
          "game_l": 1,
          "trophy": true
        },
        {
          "player": "Binni",
          "match_w": 2,
          "match_l": 1,
          "game_w": 4,
          "game_l": 4,
          "trophy": false
        },
        {
          "player": "Victor",
          "match_w": 2,
          "match_l": 1,
          "game_w": 4,
          "game_l": 3,
          "trophy": false
        },
        {
          "player": "Örvar",
          "match_w": 2,
          "match_l": 1,
          "game_w": 3,
          "game_l": 3,
          "trophy": false
        },
        {
          "player": "Atli",
          "match_w": 1,
          "match_l": 2,
          "game_w": 4,
          "game_l": 4,
          "trophy": false
        },
        {
          "player": "Tommi",
          "match_w": 1,
          "match_l": 2,
          "game_w": 4,
          "game_l": 5,
          "trophy": false
        },
        {
          "player": "Aron Gauti",
          "match_w": 1,
          "match_l": 2,
          "game_w": 3,
          "game_l": 5,
          "trophy": false
        }
      ]
    }
  ]
}
