{
  "cube": "Bolti",
  "slug": "bolti",
  "tier": "High",
  "summary": {
    "n_events": 4,
    "n_matches": 40,
    "n_players": 16,
    "first_played": "2025-09-25",
    "last_played": "2026-01-08"
  },
  "trophy_leaders": [
    {
      "player": "Ingvi",
      "trophies": 1
    },
    {
      "player": "Binni",
      "trophies": 1
    },
    {
      "player": "Diddi",
      "trophies": 1
    }
  ],
  "player_rankings": [
    {
      "player": "Ingvi",
      "match_w": 3,
      "match_l": 0,
      "match_pct": 100,
      "game_w": 6,
      "game_l": 1,
      "game_pct": 86
    },
    {
      "player": "Binni",
      "match_w": 5,
      "match_l": 1,
      "match_pct": 83,
      "game_w": 10,
      "game_l": 4,
      "game_pct": 71
    },
    {
      "player": "Diddi",
      "match_w": 3,
      "match_l": 1,
      "match_pct": 75,
      "game_w": 7,
      "game_l": 4,
      "game_pct": 64
    },
    {
      "player": "Tommi",
      "match_w": 4,
      "match_l": 5,
      "match_pct": 44,
      "game_w": 13,
      "game_l": 10,
      "game_pct": 57
    },
    {
      "player": "Aron Ívars",
      "match_w": 5,
      "match_l": 4,
      "match_pct": 56,
      "game_w": 13,
      "game_l": 10,
      "game_pct": 57
    },
    {
      "player": "Siggi",
      "match_w": 2,
      "match_l": 1,
      "match_pct": 67,
      "game_w": 4,
      "game_l": 3,
      "game_pct": 57
    },
    {
      "player": "Örvar",
      "match_w": 2,
      "match_l": 1,
      "match_pct": 67,
      "game_w": 5,
      "game_l": 4,
      "game_pct": 56
    },
    {
      "player": "Aron Freyr",
      "match_w": 6,
      "match_l": 5,
      "match_pct": 55,
      "game_w": 14,
      "game_l": 13,
      "game_pct": 52
    },
    {
      "player": "Hjalti",
      "match_w": 5,
      "match_l": 4,
      "match_pct": 56,
      "game_w": 11,
      "game_l": 12,
      "game_pct": 48
    },
    {
      "player": "Daníel",
      "match_w": 2,
      "match_l": 3,
      "match_pct": 40,
      "game_w": 7,
      "game_l": 8,
      "game_pct": 47
    },
    {
      "player": "Einar",
      "match_w": 1,
      "match_l": 3,
      "match_pct": 25,
      "game_w": 3,
      "game_l": 6,
      "game_pct": 33
    },
    {
      "player": "Ólafur",
      "match_w": 1,
      "match_l": 2,
      "match_pct": 33,
      "game_w": 2,
      "game_l": 4,
      "game_pct": 33
    },
    {
      "player": "Aron Elvar",
      "match_w": 1,
      "match_l": 2,
      "match_pct": 33,
      "game_w": 2,
      "game_l": 5,
      "game_pct": 29
    },
    {
      "player": "Aron Gauti",
      "match_w": 0,
      "match_l": 6,
      "match_pct": 0,
      "game_w": 2,
      "game_l": 12,
      "game_pct": 14
    },
    {
      "player": "Victor",
      "match_w": 0,
      "match_l": 1,
      "match_pct": 0,
      "game_w": 0,
      "game_l": 2,
      "game_pct": 0
    }
  ],
  "events": [
    {
      "date": "2026-01-08",
      "results": [
        {
          "player": "Binni",
          "match_w": 2,
          "match_l": 1,
          "game_w": 4,
          "game_l": 2,
          "trophy": false
        },
        {
          "player": "Tommi",
          "match_w": 2,
          "match_l": 1,
          "game_w": 5,
          "game_l": 2,
          "trophy": false
        },
        {
          "player": "Hjalti",
          "match_w": 2,
          "match_l": 1,
          "game_w": 5,
          "game_l": 4,
          "trophy": false
        },
        {
          "player": "Aron Freyr",
          "match_w": 1,
          "match_l": 2,
          "game_w": 3,
          "game_l": 5,
          "trophy": false
        },
        {
          "player": "Aron Elvar",
          "match_w": 1,
          "match_l": 2,
          "game_w": 2,
          "game_l": 5,
          "trophy": false
        },
        {
          "player": "Aron Ívars",
          "match_w": 1,
          "match_l": 2,
          "game_w": 3,
          "game_l": 4,
          "trophy": false
        }
      ]
    },
    {
      "date": "2025-11-06",
      "results": [
        {
          "player": "Diddi",
          "match_w": 3,
          "match_l": 0,
          "game_w": 6,
          "game_l": 2,
          "trophy": true
        },
        {
          "player": "Aron Freyr",
          "match_w": 2,
          "match_l": 1,
          "game_w": 4,
          "game_l": 3,
          "trophy": false
        },
        {
          "player": "Aron Ívars",
          "match_w": 2,
          "match_l": 1,
          "game_w": 5,
          "game_l": 3,
          "trophy": false
        },
        {
          "player": "Örvar",
          "match_w": 2,
          "match_l": 1,
          "game_w": 5,
          "game_l": 4,
          "trophy": false
        },
        {
          "player": "Hjalti",
          "match_w": 1,
          "match_l": 2,
          "game_w": 2,
          "game_l": 5,
          "trophy": false
        },
        {
          "player": "Tommi",
          "match_w": 1,
          "match_l": 2,
          "game_w": 4,
          "game_l": 4,
          "trophy": false
        },
        {
          "player": "Daníel",
          "match_w": 1,
          "match_l": 2,
          "game_w": 4,
          "game_l": 5,
          "trophy": false
        },
        {
          "player": "Aron Gauti",
          "match_w": 0,
          "match_l": 3,
          "game_w": 2,
          "game_l": 6,
          "trophy": false
        }
      ]
    },
    {
      "date": "2025-10-12",
      "results": [
        {
          "player": "Binni",
          "match_w": 3,
          "match_l": 0,
          "game_w": 6,
          "game_l": 2,
          "trophy": true
        },
        {
          "player": "Aron Ívars",
          "match_w": 2,
          "match_l": 1,
          "game_w": 5,
          "game_l": 3,
          "trophy": false
        },
        {
          "player": "Daníel",
          "match_w": 1,
          "match_l": 1,
          "game_w": 3,
          "game_l": 3,
          "trophy": false
        },
        {
          "player": "Aron Freyr",
          "match_w": 1,
          "match_l": 1,
          "game_w": 2,
          "game_l": 2,
          "trophy": false
        },
        {
          "player": "Einar",
          "match_w": 0,
          "match_l": 1,
          "game_w": 0,
          "game_l": 2,
          "trophy": false
        },
        {
          "player": "Diddi",
          "match_w": 0,
          "match_l": 1,
          "game_w": 1,
          "game_l": 2,
          "trophy": false
        },
        {
          "player": "Victor",
          "match_w": 0,
          "match_l": 1,
          "game_w": 0,
          "game_l": 2,
          "trophy": false
        }
      ]
    },
    {
      "date": "2025-09-25",
      "results": [
        {
          "player": "Ingvi",
          "match_w": 3,
          "match_l": 0,
          "game_w": 6,
          "game_l": 1,
          "trophy": true
        },
        {
          "player": "Hjalti",
          "match_w": 2,
          "match_l": 1,
          "game_w": 4,
          "game_l": 3,
          "trophy": false
        },
        {
          "player": "Aron Freyr",
          "match_w": 2,
          "match_l": 1,
          "game_w": 5,
          "game_l": 3,
          "trophy": false
        },
        {
          "player": "Siggi",
          "match_w": 2,
          "match_l": 1,
          "game_w": 4,
          "game_l": 3,
          "trophy": false
        },
        {
          "player": "Tommi",
          "match_w": 1,
          "match_l": 2,
          "game_w": 4,
          "game_l": 4,
          "trophy": false
        },
        {
          "player": "Einar",
          "match_w": 1,
          "match_l": 2,
          "game_w": 3,
          "game_l": 4,
          "trophy": false
        },
        {
          "player": "Ólafur",
          "match_w": 1,
          "match_l": 2,
          "game_w": 2,
          "game_l": 4,
          "trophy": false
        },
        {
          "player": "Aron Gauti",
          "match_w": 0,
          "match_l": 3,
          "game_w": 0,
          "game_l": 6,
          "trophy": false
        }
      ]
    }
  ]
}
