{
  "cube": "Old Border Cube",
  "slug": "old-border-cube",
  "tier": "Low",
  "summary": {
    "n_events": 2,
    "n_matches": 24,
    "n_players": 15,
    "first_played": "2025-10-12",
    "last_played": "2025-11-13"
  },
  "trophy_leaders": [
    {
      "player": "Daníel",
      "trophies": 1
    },
    {
      "player": "Örvar",
      "trophies": 1
    }
  ],
  "player_rankings": [
    {
      "player": "Örvar",
      "match_w": 3,
      "match_l": 0,
      "match_pct": 100,
      "game_w": 6,
      "game_l": 0,
      "game_pct": 100
    },
    {
      "player": "Daníel",
      "match_w": 3,
      "match_l": 0,
      "match_pct": 100,
      "game_w": 6,
      "game_l": 1,
      "game_pct": 86
    },
    {
      "player": "Aron Ívars",
      "match_w": 2,
      "match_l": 1,
      "match_pct": 67,
      "game_w": 4,
      "game_l": 2,
      "game_pct": 67
    },
    {
      "player": "Binni",
      "match_w": 2,
      "match_l": 1,
      "match_pct": 67,
      "game_w": 4,
      "game_l": 2,
      "game_pct": 67
    },
    {
      "player": "Aron Gauti",
      "match_w": 4,
      "match_l": 2,
      "match_pct": 67,
      "game_w": 8,
      "game_l": 6,
      "game_pct": 57
    },
    {
      "player": "Aron Freyr",
      "match_w": 1,
      "match_l": 2,
      "match_pct": 33,
      "game_w": 4,
      "game_l": 4,
      "game_pct": 50
    },
    {
      "player": "Einar",
      "match_w": 2,
      "match_l": 1,
      "match_pct": 67,
      "game_w": 4,
      "game_l": 4,
      "game_pct": 50
    },
    {
      "player": "Aron Elvar",
      "match_w": 1,
      "match_l": 2,
      "match_pct": 33,
      "game_w": 3,
      "game_l": 4,
      "game_pct": 43
    },
    {
      "player": "Diddi",
      "match_w": 1,
      "match_l": 2,
      "match_pct": 33,
      "game_w": 2,
      "game_l": 4,
      "game_pct": 33
    },
    {
      "player": "Oddur",
      "match_w": 0,
      "match_l": 3,
      "match_pct": 0,
      "game_w": 0,
      "game_l": 6,
      "game_pct": 0
    }
  ],
  "events": [
    {
      "date": "2025-11-13",
      "results": [
        {
          "player": "Örvar",
          "match_w": 3,
          "match_l": 0,
          "game_w": 6,
          "game_l": 0,
          "trophy": true
        },
        {
          "player": "Aron Gauti",
          "match_w": 2,
          "match_l": 1,
          "game_w": 4,
          "game_l": 3,
          "trophy": false
        },
        {
          "player": "Binni",
          "match_w": 2,
          "match_l": 1,
          "game_w": 4,
          "game_l": 2,
          "trophy": false
        },
        {
          "player": "Einar",
          "match_w": 2,
          "match_l": 1,
          "game_w": 4,
          "game_l": 4,
          "trophy": false
        },
        {
          "player": "Aron Freyr",
          "match_w": 1,
          "match_l": 2,
          "game_w": 4,
          "game_l": 4,
          "trophy": false
        },
        {
          "player": "Diddi",
          "match_w": 1,
          "match_l": 2,
          "game_w": 2,
          "game_l": 4,
          "trophy": false
        },
        {
          "player": "Aron Elvar",
          "match_w": 1,
          "match_l": 2,
          "game_w": 3,
          "game_l": 4,
          "trophy": false
        },
        {
          "player": "Oddur",
          "match_w": 0,
          "match_l": 3,
          "game_w": 0,
          "game_l": 6,
          "trophy": false
        }
      ]
    },
    {
      "date": "2025-10-12",
      "results": [
        {
          "player": "Daníel",
          "match_w": 3,
          "match_l": 0,
          "game_w": 6,
          "game_l": 1,
          "trophy": true
        },
        {
          "player": "Aron Ívars",
          "match_w": 2,
          "match_l": 1,
          "game_w": 4,
          "game_l": 2,
          "trophy": false
        },
        {
          "player": "Aron Gauti",
          "match_w": 2,
          "match_l": 1,
          "game_w": 4,
          "game_l": 3,
          "trophy": false
        }
      ]
    }
  ]
}
