{
  "cube": "Flashdance!",
  "slug": "flashdance",
  "tier": "Medium",
  "summary": {
    "n_events": 2,
    "n_matches": 24,
    "n_players": 12,
    "first_played": "2026-03-19",
    "last_played": "2026-05-28"
  },
  "trophy_leaders": [
    {
      "player": "Aron Elvar",
      "trophies": 1
    },
    {
      "player": "Örvar",
      "trophies": 1
    }
  ],
  "player_rankings": [
    {
      "player": "Aron Elvar",
      "match_w": 3,
      "match_l": 0,
      "match_pct": 100,
      "game_w": 6,
      "game_l": 2,
      "game_pct": 75
    },
    {
      "player": "Binni",
      "match_w": 2,
      "match_l": 1,
      "match_pct": 67,
      "game_w": 5,
      "game_l": 3,
      "game_pct": 62
    },
    {
      "player": "Örvar",
      "match_w": 4,
      "match_l": 2,
      "match_pct": 67,
      "game_w": 9,
      "game_l": 6,
      "game_pct": 60
    },
    {
      "player": "Móses",
      "match_w": 2,
      "match_l": 1,
      "match_pct": 67,
      "game_w": 4,
      "game_l": 3,
      "game_pct": 57
    },
    {
      "player": "Oddur",
      "match_w": 2,
      "match_l": 1,
      "match_pct": 67,
      "game_w": 5,
      "game_l": 4,
      "game_pct": 56
    },
    {
      "player": "Arnar",
      "match_w": 2,
      "match_l": 1,
      "match_pct": 67,
      "game_w": 4,
      "game_l": 4,
      "game_pct": 50
    },
    {
      "player": "Aron Freyr",
      "match_w": 1,
      "match_l": 2,
      "match_pct": 33,
      "game_w": 4,
      "game_l": 4,
      "game_pct": 50
    },
    {
      "player": "Ólafur",
      "match_w": 1,
      "match_l": 2,
      "match_pct": 33,
      "game_w": 3,
      "game_l": 4,
      "game_pct": 43
    },
    {
      "player": "Tommi",
      "match_w": 2,
      "match_l": 4,
      "match_pct": 33,
      "game_w": 6,
      "game_l": 9,
      "game_pct": 40
    },
    {
      "player": "Diddi",
      "match_w": 2,
      "match_l": 4,
      "match_pct": 33,
      "game_w": 6,
      "game_l": 10,
      "game_pct": 38
    },
    {
      "player": "Friðrik",
      "match_w": 1,
      "match_l": 5,
      "match_pct": 17,
      "game_w": 5,
      "game_l": 10,
      "game_pct": 33
    }
  ],
  "events": [
    {
      "date": "2026-05-28",
      "results": [
        {
          "player": "Örvar",
          "match_w": 3,
          "match_l": 0,
          "game_w": 6,
          "game_l": 2,
          "trophy": true
        },
        {
          "player": "Diddi",
          "match_w": 2,
          "match_l": 1,
          "game_w": 5,
          "game_l": 4,
          "trophy": false
        },
        {
          "player": "Ólafur",
          "match_w": 1,
          "match_l": 2,
          "game_w": 3,
          "game_l": 4,
          "trophy": false
        },
        {
          "player": "Tommi",
          "match_w": 1,
          "match_l": 2,
          "game_w": 3,
          "game_l": 4,
          "trophy": false
        },
        {
          "player": "Friðrik",
          "match_w": 0,
          "match_l": 3,
          "game_w": 1,
          "game_l": 6,
          "trophy": false
        }
      ]
    },
    {
      "date": "2026-03-19",
      "results": [
        {
          "player": "Aron Elvar",
          "match_w": 3,
          "match_l": 0,
          "game_w": 6,
          "game_l": 2,
          "trophy": true
        },
        {
          "player": "Binni",
          "match_w": 2,
          "match_l": 1,
          "game_w": 5,
          "game_l": 3,
          "trophy": false
        },
        {
          "player": "Móses",
          "match_w": 2,
          "match_l": 1,
          "game_w": 4,
          "game_l": 3,
          "trophy": false
        },
        {
          "player": "Arnar",
          "match_w": 2,
          "match_l": 1,
          "game_w": 4,
          "game_l": 4,
          "trophy": false
        },
        {
          "player": "Oddur",
          "match_w": 2,
          "match_l": 1,
          "game_w": 5,
          "game_l": 4,
          "trophy": false
        },
        {
          "player": "Tommi",
          "match_w": 1,
          "match_l": 2,
          "game_w": 3,
          "game_l": 5,
          "trophy": false
        },
        {
          "player": "Friðrik",
          "match_w": 1,
          "match_l": 2,
          "game_w": 4,
          "game_l": 4,
          "trophy": false
        },
        {
          "player": "Aron Freyr",
          "match_w": 1,
          "match_l": 2,
          "game_w": 4,
          "game_l": 4,
          "trophy": false
        },
        {
          "player": "Örvar",
          "match_w": 1,
          "match_l": 2,
          "game_w": 3,
          "game_l": 4,
          "trophy": false
        },
        {
          "player": "Diddi",
          "match_w": 0,
          "match_l": 3,
          "game_w": 1,
          "game_l": 6,
          "trophy": false
        }
      ]
    }
  ]
}
