{
  "cube": "Standard Meta Cube",
  "slug": "standard-meta-cube",
  "tier": "Other",
  "summary": {
    "n_events": 1,
    "n_matches": 12,
    "n_players": 8,
    "first_played": "2026-07-09",
    "last_played": "2026-07-09"
  },
  "trophy_leaders": [
    {
      "player": "Aron Freyr",
      "trophies": 1
    }
  ],
  "player_rankings": [
    {
      "player": "Aron Freyr",
      "match_w": 3,
      "match_l": 0,
      "match_pct": 100,
      "game_w": 6,
      "game_l": 0,
      "game_pct": 100
    },
    {
      "player": "Einar",
      "match_w": 2,
      "match_l": 1,
      "match_pct": 67,
      "game_w": 4,
      "game_l": 2,
      "game_pct": 67
    },
    {
      "player": "Örvar",
      "match_w": 2,
      "match_l": 1,
      "match_pct": 67,
      "game_w": 4,
      "game_l": 4,
      "game_pct": 50
    },
    {
      "player": "Atli",
      "match_w": 2,
      "match_l": 1,
      "match_pct": 67,
      "game_w": 4,
      "game_l": 4,
      "game_pct": 50
    },
    {
      "player": "Einar Logi",
      "match_w": 1,
      "match_l": 2,
      "match_pct": 33,
      "game_w": 4,
      "game_l": 5,
      "game_pct": 44
    },
    {
      "player": "Tommi",
      "match_w": 1,
      "match_l": 2,
      "match_pct": 33,
      "game_w": 3,
      "game_l": 5,
      "game_pct": 38
    },
    {
      "player": "Diddi",
      "match_w": 1,
      "match_l": 2,
      "match_pct": 33,
      "game_w": 3,
      "game_l": 5,
      "game_pct": 38
    },
    {
      "player": "Anna",
      "match_w": 0,
      "match_l": 3,
      "match_pct": 0,
      "game_w": 3,
      "game_l": 6,
      "game_pct": 33
    }
  ],
  "events": [
    {
      "date": "2026-07-09",
      "results": [
        {
          "player": "Aron Freyr",
          "match_w": 3,
          "match_l": 0,
          "game_w": 6,
          "game_l": 0,
          "trophy": true
        },
        {
          "player": "Örvar",
          "match_w": 2,
          "match_l": 1,
          "game_w": 4,
          "game_l": 4,
          "trophy": false
        },
        {
          "player": "Atli",
          "match_w": 2,
          "match_l": 1,
          "game_w": 4,
          "game_l": 4,
          "trophy": false
        },
        {
          "player": "Einar",
          "match_w": 2,
          "match_l": 1,
          "game_w": 4,
          "game_l": 2,
          "trophy": false
        },
        {
          "player": "Einar Logi",
          "match_w": 1,
          "match_l": 2,
          "game_w": 4,
          "game_l": 5,
          "trophy": false
        },
        {
          "player": "Tommi",
          "match_w": 1,
          "match_l": 2,
          "game_w": 3,
          "game_l": 5,
          "trophy": false
        },
        {
          "player": "Diddi",
          "match_w": 1,
          "match_l": 2,
          "game_w": 3,
          "game_l": 5,
          "trophy": false
        },
        {
          "player": "Anna",
          "match_w": 0,
          "match_l": 3,
          "game_w": 3,
          "game_l": 6,
          "trophy": false
        }
      ]
    }
  ]
}
