{
  "cube": "Stone Soup Cube",
  "slug": "stone-soup-cube",
  "tier": "Other",
  "summary": {
    "n_events": 3,
    "n_matches": 49,
    "n_players": 22,
    "first_played": "2025-08-28",
    "last_played": "2025-12-04"
  },
  "trophy_leaders": [
    {
      "player": "Tommi",
      "trophies": 2
    },
    {
      "player": "Binni",
      "trophies": 1
    },
    {
      "player": "Aron Freyr",
      "trophies": 1
    },
    {
      "player": "Diddi",
      "trophies": 1
    }
  ],
  "player_rankings": [
    {
      "player": "Aron Freyr",
      "match_w": 3,
      "match_l": 1,
      "match_pct": 75,
      "game_w": 7,
      "game_l": 2,
      "game_pct": 78
    },
    {
      "player": "Tommi",
      "match_w": 6,
      "match_l": 2,
      "match_pct": 75,
      "game_w": 12,
      "game_l": 5,
      "game_pct": 71
    },
    {
      "player": "Diddi",
      "match_w": 7,
      "match_l": 2,
      "match_pct": 78,
      "game_w": 15,
      "game_l": 7,
      "game_pct": 68
    },
    {
      "player": "Binni",
      "match_w": 4,
      "match_l": 2,
      "match_pct": 67,
      "game_w": 10,
      "game_l": 6,
      "game_pct": 62
    },
    {
      "player": "Arnar",
      "match_w": 2,
      "match_l": 1,
      "match_pct": 67,
      "game_w": 5,
      "game_l": 3,
      "game_pct": 62
    },
    {
      "player": "Aron Elvar",
      "match_w": 3,
      "match_l": 2,
      "match_pct": 60,
      "game_w": 8,
      "game_l": 6,
      "game_pct": 57
    },
    {
      "player": "Örvar",
      "match_w": 4,
      "match_l": 2,
      "match_pct": 67,
      "game_w": 8,
      "game_l": 6,
      "game_pct": 57
    },
    {
      "player": "Einar",
      "match_w": 3,
      "match_l": 3,
      "match_pct": 50,
      "game_w": 8,
      "game_l": 8,
      "game_pct": 50
    },
    {
      "player": "Daníel",
      "match_w": 3,
      "match_l": 3,
      "match_pct": 50,
      "game_w": 8,
      "game_l": 8,
      "game_pct": 50
    },
    {
      "player": "Ingvi",
      "match_w": 2,
      "match_l": 2,
      "match_pct": 50,
      "game_w": 6,
      "game_l": 6,
      "game_pct": 50
    },
    {
      "player": "Siggi",
      "match_w": 2,
      "match_l": 1,
      "match_pct": 67,
      "game_w": 4,
      "game_l": 4,
      "game_pct": 50
    },
    {
      "player": "Atli",
      "match_w": 2,
      "match_l": 1,
      "match_pct": 67,
      "game_w": 3,
      "game_l": 3,
      "game_pct": 50
    },
    {
      "player": "Anna",
      "match_w": 3,
      "match_l": 3,
      "match_pct": 50,
      "game_w": 7,
      "game_l": 8,
      "game_pct": 47
    },
    {
      "player": "Styrmir",
      "match_w": 2,
      "match_l": 4,
      "match_pct": 33,
      "game_w": 6,
      "game_l": 9,
      "game_pct": 40
    },
    {
      "player": "Ólafur",
      "match_w": 1,
      "match_l": 2,
      "match_pct": 33,
      "game_w": 3,
      "game_l": 5,
      "game_pct": 38
    },
    {
      "player": "Aron Gauti",
      "match_w": 0,
      "match_l": 2,
      "match_pct": 0,
      "game_w": 1,
      "game_l": 3,
      "game_pct": 25
    },
    {
      "player": "Hjalti",
      "match_w": 0,
      "match_l": 2,
      "match_pct": 0,
      "game_w": 1,
      "game_l": 4,
      "game_pct": 20
    },
    {
      "player": "Oddur",
      "match_w": 0,
      "match_l": 6,
      "match_pct": 0,
      "game_w": 2,
      "game_l": 12,
      "game_pct": 14
    }
  ],
  "events": [
    {
      "date": "2025-12-04",
      "results": [
        {
          "player": "Diddi",
          "match_w": 3,
          "match_l": 0,
          "game_w": 6,
          "game_l": 1,
          "trophy": true
        },
        {
          "player": "Örvar",
          "match_w": 2,
          "match_l": 1,
          "game_w": 4,
          "game_l": 3,
          "trophy": false
        },
        {
          "player": "Atli",
          "match_w": 2,
          "match_l": 1,
          "game_w": 3,
          "game_l": 3,
          "trophy": false
        },
        {
          "player": "Aron Elvar",
          "match_w": 2,
          "match_l": 1,
          "game_w": 5,
          "game_l": 4,
          "trophy": false
        },
        {
          "player": "Daníel",
          "match_w": 2,
          "match_l": 1,
          "game_w": 4,
          "game_l": 3,
          "trophy": false
        },
        {
          "player": "Binni",
          "match_w": 1,
          "match_l": 2,
          "game_w": 4,
          "game_l": 4,
          "trophy": false
        },
        {
          "player": "Hjalti",
          "match_w": 0,
          "match_l": 2,
          "game_w": 1,
          "game_l": 4,
          "trophy": false
        },
        {
          "player": "Aron Gauti",
          "match_w": 0,
          "match_l": 2,
          "game_w": 1,
          "game_l": 3,
          "trophy": false
        },
        {
          "player": "Tommi",
          "match_w": 0,
          "match_l": 2,
          "game_w": 0,
          "game_l": 3,
          "trophy": false
        }
      ]
    },
    {
      "date": "2025-10-23",
      "results": [
        {
          "player": "Aron Freyr",
          "match_w": 3,
          "match_l": 1,
          "game_w": 7,
          "game_l": 2,
          "trophy": true
        },
        {
          "player": "Tommi",
          "match_w": 3,
          "match_l": 0,
          "game_w": 6,
          "game_l": 0,
          "trophy": true
        },
        {
          "player": "Einar",
          "match_w": 2,
          "match_l": 1,
          "game_w": 4,
          "game_l": 3,
          "trophy": false
        },
        {
          "player": "Ingvi",
          "match_w": 2,
          "match_l": 0,
          "game_w": 4,
          "game_l": 2,
          "trophy": false
        },
        {
          "player": "Örvar",
          "match_w": 2,
          "match_l": 1,
          "game_w": 4,
          "game_l": 3,
          "trophy": false
        },
        {
          "player": "Diddi",
          "match_w": 2,
          "match_l": 1,
          "game_w": 4,
          "game_l": 2,
          "trophy": false
        },
        {
          "player": "Aron Elvar",
          "match_w": 1,
          "match_l": 1,
          "game_w": 3,
          "game_l": 2,
          "trophy": false
        },
        {
          "player": "Ólafur",
          "match_w": 1,
          "match_l": 2,
          "game_w": 3,
          "game_l": 5,
          "trophy": false
        },
        {
          "player": "Anna",
          "match_w": 1,
          "match_l": 2,
          "game_w": 2,
          "game_l": 4,
          "trophy": false
        },
        {
          "player": "Styrmir",
          "match_w": 1,
          "match_l": 2,
          "game_w": 3,
          "game_l": 4,
          "trophy": false
        },
        {
          "player": "Oddur",
          "match_w": 0,
          "match_l": 3,
          "game_w": 0,
          "game_l": 6,
          "trophy": false
        }
      ]
    },
    {
      "date": "2025-08-28",
      "results": [
        {
          "player": "Binni",
          "match_w": 3,
          "match_l": 0,
          "game_w": 6,
          "game_l": 2,
          "trophy": true
        },
        {
          "player": "Tommi",
          "match_w": 3,
          "match_l": 0,
          "game_w": 6,
          "game_l": 2,
          "trophy": true
        },
        {
          "player": "Diddi",
          "match_w": 2,
          "match_l": 1,
          "game_w": 5,
          "game_l": 4,
          "trophy": false
        },
        {
          "player": "Siggi",
          "match_w": 2,
          "match_l": 1,
          "game_w": 4,
          "game_l": 4,
          "trophy": false
        },
        {
          "player": "Anna",
          "match_w": 2,
          "match_l": 1,
          "game_w": 5,
          "game_l": 4,
          "trophy": false
        },
        {
          "player": "Arnar",
          "match_w": 2,
          "match_l": 1,
          "game_w": 5,
          "game_l": 3,
          "trophy": false
        },
        {
          "player": "Styrmir",
          "match_w": 1,
          "match_l": 2,
          "game_w": 3,
          "game_l": 5,
          "trophy": false
        },
        {
          "player": "Einar",
          "match_w": 1,
          "match_l": 2,
          "game_w": 4,
          "game_l": 5,
          "trophy": false
        },
        {
          "player": "Daníel",
          "match_w": 1,
          "match_l": 2,
          "game_w": 4,
          "game_l": 5,
          "trophy": false
        },
        {
          "player": "Oddur",
          "match_w": 0,
          "match_l": 3,
          "game_w": 2,
          "game_l": 6,
          "trophy": false
        },
        {
          "player": "Ingvi",
          "match_w": 0,
          "match_l": 2,
          "game_w": 2,
          "game_l": 4,
          "trophy": false
        }
      ]
    }
  ]
}
