{
  "cube": "Pauper Cube Diddi",
  "slug": "pauper-cube-diddi",
  "tier": "Low",
  "summary": {
    "n_events": 1,
    "n_matches": 9,
    "n_players": 6,
    "first_played": "2025-10-12",
    "last_played": "2025-10-12"
  },
  "trophy_leaders": [
    {
      "player": "Örvar",
      "trophies": 1
    }
  ],
  "player_rankings": [
    {
      "player": "Victor",
      "match_w": 2,
      "match_l": 1,
      "match_pct": 67,
      "game_w": 5,
      "game_l": 1,
      "game_pct": 83
    },
    {
      "player": "Örvar",
      "match_w": 3,
      "match_l": 0,
      "match_pct": 100,
      "game_w": 5,
      "game_l": 3,
      "game_pct": 62
    },
    {
      "player": "Ólafur",
      "match_w": 1,
      "match_l": 2,
      "match_pct": 33,
      "game_w": 3,
      "game_l": 5,
      "game_pct": 38
    },
    {
      "player": "Aron Gauti",
      "match_w": 0,
      "match_l": 3,
      "match_pct": 0,
      "game_w": 3,
      "game_l": 6,
      "game_pct": 33
    }
  ],
  "events": [
    {
      "date": "2025-10-12",
      "results": [
        {
          "player": "Örvar",
          "match_w": 3,
          "match_l": 0,
          "game_w": 5,
          "game_l": 3,
          "trophy": true
        },
        {
          "player": "Victor",
          "match_w": 2,
          "match_l": 1,
          "game_w": 5,
          "game_l": 1,
          "trophy": false
        },
        {
          "player": "Ólafur",
          "match_w": 1,
          "match_l": 2,
          "game_w": 3,
          "game_l": 5,
          "trophy": false
        },
        {
          "player": "Aron Gauti",
          "match_w": 0,
          "match_l": 3,
          "game_w": 3,
          "game_l": 6,
          "trophy": false
        }
      ]
    }
  ]
}
