{
  "cube": "Nerva's Cube",
  "slug": "nerva-s-cube",
  "tier": "High",
  "summary": {
    "n_events": 4,
    "n_matches": 48,
    "n_players": 20,
    "first_played": "2025-10-10",
    "last_played": "2026-04-04"
  },
  "trophy_leaders": [
    {
      "player": "Aron Freyr",
      "trophies": 2
    },
    {
      "player": "Örvar",
      "trophies": 2
    },
    {
      "player": "Diddi",
      "trophies": 1
    },
    {
      "player": "Friðrik",
      "trophies": 1
    }
  ],
  "player_rankings": [
    {
      "player": "Friðrik",
      "match_w": 3,
      "match_l": 0,
      "match_pct": 100,
      "game_w": 6,
      "game_l": 1,
      "game_pct": 86
    },
    {
      "player": "Aron Freyr",
      "match_w": 10,
      "match_l": 2,
      "match_pct": 83,
      "game_w": 21,
      "game_l": 9,
      "game_pct": 70
    },
    {
      "player": "Örvar",
      "match_w": 7,
      "match_l": 2,
      "match_pct": 78,
      "game_w": 13,
      "game_l": 7,
      "game_pct": 65
    },
    {
      "player": "Diddi",
      "match_w": 7,
      "match_l": 5,
      "match_pct": 58,
      "game_w": 18,
      "game_l": 11,
      "game_pct": 62
    },
    {
      "player": "Aron Elvar",
      "match_w": 2,
      "match_l": 1,
      "match_pct": 67,
      "game_w": 4,
      "game_l": 3,
      "game_pct": 57
    },
    {
      "player": "Tommi",
      "match_w": 5,
      "match_l": 4,
      "match_pct": 56,
      "game_w": 11,
      "game_l": 10,
      "game_pct": 52
    },
    {
      "player": "Ólafur",
      "match_w": 4,
      "match_l": 5,
      "match_pct": 44,
      "game_w": 10,
      "game_l": 10,
      "game_pct": 50
    },
    {
      "player": "Aron Ívars",
      "match_w": 2,
      "match_l": 4,
      "match_pct": 33,
      "game_w": 7,
      "game_l": 9,
      "game_pct": 44
    },
    {
      "player": "Ingvi",
      "match_w": 1,
      "match_l": 2,
      "match_pct": 33,
      "game_w": 4,
      "game_l": 5,
      "game_pct": 44
    },
    {
      "player": "Anna",
      "match_w": 1,
      "match_l": 2,
      "match_pct": 33,
      "game_w": 3,
      "game_l": 4,
      "game_pct": 43
    },
    {
      "player": "Oddur",
      "match_w": 1,
      "match_l": 2,
      "match_pct": 33,
      "game_w": 3,
      "game_l": 5,
      "game_pct": 38
    },
    {
      "player": "Atli",
      "match_w": 1,
      "match_l": 2,
      "match_pct": 33,
      "game_w": 3,
      "game_l": 5,
      "game_pct": 38
    },
    {
      "player": "Einar",
      "match_w": 0,
      "match_l": 2,
      "match_pct": 0,
      "game_w": 2,
      "game_l": 4,
      "game_pct": 33
    },
    {
      "player": "Binni",
      "match_w": 0,
      "match_l": 2,
      "match_pct": 0,
      "game_w": 1,
      "game_l": 4,
      "game_pct": 20
    },
    {
      "player": "Victor",
      "match_w": 0,
      "match_l": 2,
      "match_pct": 0,
      "game_w": 1,
      "game_l": 4,
      "game_pct": 20
    },
    {
      "player": "Aron Gauti",
      "match_w": 0,
      "match_l": 2,
      "match_pct": 0,
      "game_w": 0,
      "game_l": 4,
      "game_pct": 0
    }
  ],
  "events": [
    {
      "date": "2026-04-04",
      "results": [
        {
          "player": "Friðrik",
          "match_w": 3,
          "match_l": 0,
          "game_w": 6,
          "game_l": 1,
          "trophy": true
        },
        {
          "player": "Tommi",
          "match_w": 2,
          "match_l": 1,
          "game_w": 4,
          "game_l": 3,
          "trophy": false
        },
        {
          "player": "Aron Freyr",
          "match_w": 2,
          "match_l": 1,
          "game_w": 5,
          "game_l": 3,
          "trophy": false
        },
        {
          "player": "Atli",
          "match_w": 1,
          "match_l": 2,
          "game_w": 3,
          "game_l": 5,
          "trophy": false
        },
        {
          "player": "Aron Ívars",
          "match_w": 1,
          "match_l": 2,
          "game_w": 4,
          "game_l": 5,
          "trophy": false
        },
        {
          "player": "Örvar",
          "match_w": 1,
          "match_l": 2,
          "game_w": 3,
          "game_l": 5,
          "trophy": false
        },
        {
          "player": "Diddi",
          "match_w": 0,
          "match_l": 3,
          "game_w": 3,
          "game_l": 6,
          "trophy": false
        }
      ]
    },
    {
      "date": "2025-12-29",
      "results": [
        {
          "player": "Örvar",
          "match_w": 3,
          "match_l": 0,
          "game_w": 6,
          "game_l": 0,
          "trophy": true
        },
        {
          "player": "Ólafur",
          "match_w": 2,
          "match_l": 1,
          "game_w": 4,
          "game_l": 2,
          "trophy": false
        },
        {
          "player": "Aron Freyr",
          "match_w": 2,
          "match_l": 1,
          "game_w": 4,
          "game_l": 2,
          "trophy": false
        },
        {
          "player": "Diddi",
          "match_w": 2,
          "match_l": 1,
          "game_w": 4,
          "game_l": 3,
          "trophy": false
        },
        {
          "player": "Aron Elvar",
          "match_w": 2,
          "match_l": 1,
          "game_w": 4,
          "game_l": 3,
          "trophy": false
        },
        {
          "player": "Aron Ívars",
          "match_w": 1,
          "match_l": 2,
          "game_w": 3,
          "game_l": 4,
          "trophy": false
        },
        {
          "player": "Tommi",
          "match_w": 1,
          "match_l": 2,
          "game_w": 3,
          "game_l": 4,
          "trophy": false
        },
        {
          "player": "Binni",
          "match_w": 0,
          "match_l": 2,
          "game_w": 1,
          "game_l": 4,
          "trophy": false
        },
        {
          "player": "Victor",
          "match_w": 0,
          "match_l": 2,
          "game_w": 1,
          "game_l": 4,
          "trophy": false
        }
      ]
    },
    {
      "date": "2025-10-12",
      "results": [
        {
          "player": "Örvar",
          "match_w": 3,
          "match_l": 0,
          "game_w": 4,
          "game_l": 2,
          "trophy": true
        },
        {
          "player": "Aron Freyr",
          "match_w": 3,
          "match_l": 0,
          "game_w": 6,
          "game_l": 2,
          "trophy": true
        },
        {
          "player": "Diddi",
          "match_w": 2,
          "match_l": 1,
          "game_w": 5,
          "game_l": 2,
          "trophy": false
        },
        {
          "player": "Ingvi",
          "match_w": 1,
          "match_l": 2,
          "game_w": 4,
          "game_l": 5,
          "trophy": false
        },
        {
          "player": "Ólafur",
          "match_w": 0,
          "match_l": 3,
          "game_w": 2,
          "game_l": 5,
          "trophy": false
        }
      ]
    },
    {
      "date": "2025-10-10",
      "results": [
        {
          "player": "Diddi",
          "match_w": 3,
          "match_l": 0,
          "game_w": 6,
          "game_l": 0,
          "trophy": true
        },
        {
          "player": "Aron Freyr",
          "match_w": 3,
          "match_l": 0,
          "game_w": 6,
          "game_l": 2,
          "trophy": true
        },
        {
          "player": "Tommi",
          "match_w": 2,
          "match_l": 1,
          "game_w": 4,
          "game_l": 3,
          "trophy": false
        },
        {
          "player": "Ólafur",
          "match_w": 2,
          "match_l": 1,
          "game_w": 4,
          "game_l": 3,
          "trophy": false
        },
        {
          "player": "Anna",
          "match_w": 1,
          "match_l": 2,
          "game_w": 3,
          "game_l": 4,
          "trophy": false
        },
        {
          "player": "Oddur",
          "match_w": 1,
          "match_l": 2,
          "game_w": 3,
          "game_l": 5,
          "trophy": false
        },
        {
          "player": "Aron Gauti",
          "match_w": 0,
          "match_l": 2,
          "game_w": 0,
          "game_l": 4,
          "trophy": false
        },
        {
          "player": "Einar",
          "match_w": 0,
          "match_l": 2,
          "game_w": 2,
          "game_l": 4,
          "trophy": false
        }
      ]
    }
  ]
}
