{
  "cube": "Vintage Aron",
  "slug": "vintage-aron",
  "tier": "High",
  "summary": {
    "n_events": 3,
    "n_matches": 46,
    "n_players": 17,
    "first_played": "2025-09-04",
    "last_played": "2026-06-04"
  },
  "trophy_leaders": [
    {
      "player": "Hjalti",
      "trophies": 1
    },
    {
      "player": "Aron Elvar",
      "trophies": 1
    },
    {
      "player": "Örvar",
      "trophies": 1
    },
    {
      "player": "Aron Freyr",
      "trophies": 1
    }
  ],
  "player_rankings": [
    {
      "player": "Örvar",
      "match_w": 5,
      "match_l": 2,
      "match_pct": 71,
      "game_w": 12,
      "game_l": 6,
      "game_pct": 67
    },
    {
      "player": "Hjalti",
      "match_w": 5,
      "match_l": 1,
      "match_pct": 83,
      "game_w": 10,
      "game_l": 5,
      "game_pct": 67
    },
    {
      "player": "Aron Elvar",
      "match_w": 6,
      "match_l": 3,
      "match_pct": 67,
      "game_w": 15,
      "game_l": 9,
      "game_pct": 62
    },
    {
      "player": "Diddi",
      "match_w": 4,
      "match_l": 2,
      "match_pct": 67,
      "game_w": 9,
      "game_l": 6,
      "game_pct": 60
    },
    {
      "player": "Binni",
      "match_w": 4,
      "match_l": 2,
      "match_pct": 67,
      "game_w": 9,
      "game_l": 6,
      "game_pct": 60
    },
    {
      "player": "Tommi",
      "match_w": 5,
      "match_l": 3,
      "match_pct": 62,
      "game_w": 11,
      "game_l": 10,
      "game_pct": 52
    },
    {
      "player": "Aron Ívars",
      "match_w": 5,
      "match_l": 4,
      "match_pct": 56,
      "game_w": 11,
      "game_l": 11,
      "game_pct": 50
    },
    {
      "player": "Atli",
      "match_w": 3,
      "match_l": 3,
      "match_pct": 50,
      "game_w": 7,
      "game_l": 7,
      "game_pct": 50
    },
    {
      "player": "Anna",
      "match_w": 1,
      "match_l": 2,
      "match_pct": 33,
      "game_w": 4,
      "game_l": 4,
      "game_pct": 50
    },
    {
      "player": "Aron Freyr",
      "match_w": 4,
      "match_l": 5,
      "match_pct": 44,
      "game_w": 11,
      "game_l": 12,
      "game_pct": 48
    },
    {
      "player": "Styrmir",
      "match_w": 1,
      "match_l": 3,
      "match_pct": 25,
      "game_w": 5,
      "game_l": 6,
      "game_pct": 45
    },
    {
      "player": "Friðrik",
      "match_w": 1,
      "match_l": 2,
      "match_pct": 33,
      "game_w": 3,
      "game_l": 4,
      "game_pct": 43
    },
    {
      "player": "Móses",
      "match_w": 1,
      "match_l": 2,
      "match_pct": 33,
      "game_w": 3,
      "game_l": 5,
      "game_pct": 38
    },
    {
      "player": "Einar",
      "match_w": 0,
      "match_l": 2,
      "match_pct": 0,
      "game_w": 2,
      "game_l": 4,
      "game_pct": 33
    },
    {
      "player": "Aron Gauti",
      "match_w": 1,
      "match_l": 5,
      "match_pct": 17,
      "game_w": 4,
      "game_l": 11,
      "game_pct": 27
    },
    {
      "player": "Ingvi",
      "match_w": 0,
      "match_l": 3,
      "match_pct": 0,
      "game_w": 0,
      "game_l": 6,
      "game_pct": 0
    },
    {
      "player": "Oddur",
      "match_w": 0,
      "match_l": 2,
      "match_pct": 0,
      "game_w": 0,
      "game_l": 4,
      "game_pct": 0
    }
  ],
  "events": [
    {
      "date": "2026-06-04",
      "results": [
        {
          "player": "Örvar",
          "match_w": 3,
          "match_l": 0,
          "game_w": 6,
          "game_l": 2,
          "trophy": true
        },
        {
          "player": "Binni",
          "match_w": 2,
          "match_l": 1,
          "game_w": 4,
          "game_l": 3,
          "trophy": false
        },
        {
          "player": "Aron Elvar",
          "match_w": 2,
          "match_l": 1,
          "game_w": 5,
          "game_l": 3,
          "trophy": false
        },
        {
          "player": "Aron Ívars",
          "match_w": 2,
          "match_l": 1,
          "game_w": 5,
          "game_l": 3,
          "trophy": false
        },
        {
          "player": "Atli",
          "match_w": 2,
          "match_l": 1,
          "game_w": 4,
          "game_l": 3,
          "trophy": false
        },
        {
          "player": "Tommi",
          "match_w": 2,
          "match_l": 1,
          "game_w": 4,
          "game_l": 3,
          "trophy": false
        },
        {
          "player": "Aron Freyr",
          "match_w": 1,
          "match_l": 2,
          "game_w": 3,
          "game_l": 4,
          "trophy": false
        },
        {
          "player": "Styrmir",
          "match_w": 1,
          "match_l": 1,
          "game_w": 3,
          "game_l": 2,
          "trophy": false
        },
        {
          "player": "Einar",
          "match_w": 0,
          "match_l": 2,
          "game_w": 2,
          "game_l": 4,
          "trophy": false
        },
        {
          "player": "Aron Gauti",
          "match_w": 0,
          "match_l": 3,
          "game_w": 1,
          "game_l": 6,
          "trophy": false
        },
        {
          "player": "Oddur",
          "match_w": 0,
          "match_l": 2,
          "game_w": 0,
          "game_l": 4,
          "trophy": false
        }
      ]
    },
    {
      "date": "2026-03-05",
      "results": [
        {
          "player": "Hjalti",
          "match_w": 3,
          "match_l": 0,
          "game_w": 6,
          "game_l": 2,
          "trophy": true
        },
        {
          "player": "Aron Elvar",
          "match_w": 3,
          "match_l": 0,
          "game_w": 6,
          "game_l": 2,
          "trophy": true
        },
        {
          "player": "Diddi",
          "match_w": 2,
          "match_l": 1,
          "game_w": 5,
          "game_l": 3,
          "trophy": false
        },
        {
          "player": "Binni",
          "match_w": 2,
          "match_l": 1,
          "game_w": 5,
          "game_l": 3,
          "trophy": false
        },
        {
          "player": "Aron Ívars",
          "match_w": 2,
          "match_l": 1,
          "game_w": 4,
          "game_l": 4,
          "trophy": false
        },
        {
          "player": "Móses",
          "match_w": 1,
          "match_l": 2,
          "game_w": 3,
          "game_l": 5,
          "trophy": false
        },
        {
          "player": "Atli",
          "match_w": 1,
          "match_l": 2,
          "game_w": 3,
          "game_l": 4,
          "trophy": false
        },
        {
          "player": "Anna",
          "match_w": 1,
          "match_l": 2,
          "game_w": 4,
          "game_l": 4,
          "trophy": false
        },
        {
          "player": "Friðrik",
          "match_w": 1,
          "match_l": 2,
          "game_w": 3,
          "game_l": 4,
          "trophy": false
        },
        {
          "player": "Aron Gauti",
          "match_w": 1,
          "match_l": 2,
          "game_w": 3,
          "game_l": 5,
          "trophy": false
        },
        {
          "player": "Tommi",
          "match_w": 1,
          "match_l": 2,
          "game_w": 3,
          "game_l": 5,
          "trophy": false
        },
        {
          "player": "Aron Freyr",
          "match_w": 0,
          "match_l": 3,
          "game_w": 2,
          "game_l": 6,
          "trophy": false
        }
      ]
    },
    {
      "date": "2025-09-04",
      "results": [
        {
          "player": "Aron Freyr",
          "match_w": 3,
          "match_l": 0,
          "game_w": 6,
          "game_l": 2,
          "trophy": true
        },
        {
          "player": "Tommi",
          "match_w": 2,
          "match_l": 0,
          "game_w": 4,
          "game_l": 2,
          "trophy": false
        },
        {
          "player": "Örvar",
          "match_w": 2,
          "match_l": 2,
          "game_w": 6,
          "game_l": 4,
          "trophy": false
        },
        {
          "player": "Hjalti",
          "match_w": 2,
          "match_l": 1,
          "game_w": 4,
          "game_l": 3,
          "trophy": false
        },
        {
          "player": "Diddi",
          "match_w": 2,
          "match_l": 1,
          "game_w": 4,
          "game_l": 3,
          "trophy": false
        },
        {
          "player": "Aron Elvar",
          "match_w": 1,
          "match_l": 2,
          "game_w": 4,
          "game_l": 4,
          "trophy": false
        },
        {
          "player": "Aron Ívars",
          "match_w": 1,
          "match_l": 2,
          "game_w": 2,
          "game_l": 4,
          "trophy": false
        },
        {
          "player": "Ingvi",
          "match_w": 0,
          "match_l": 3,
          "game_w": 0,
          "game_l": 6,
          "trophy": false
        },
        {
          "player": "Styrmir",
          "match_w": 0,
          "match_l": 2,
          "game_w": 2,
          "game_l": 4,
          "trophy": false
        }
      ]
    }
  ]
}
